[
  {
    "id": 111,
    "firstname": "Joana",
    "surname": "Ramos",
    "country": "Portugal",
    "countryCode": "pt",
    "weightClass": "-52",
    "stats": {
      "power": 6,
      "speed": 7,
      "technique": 8,
      "kumikata": 7,
      "newaza": 6
    },
    "signatureMoveId": 1,
    "lastUpdated": "2025-04-22T10:00:00Z",
    "profileUrl": "https://en.wikipedia.org/wiki/Joana_Ramos",
    "bio": "More info to come...",
    "gender": "female",
    "isHidden": false,
    "rarity": "Common",
    "cardCode": "WKZ3-H4NF-MXT2-LQ93-JT8C",
    "matchesWon": 0,
    "matchesLost": 0,
    "matchesDrew": 0
  },
  {
    "id": 114,
    "firstname": "Nina",
    "surname": "Cutro-Kelly",
    "country": "USA",
    "countryCode": "us",
    "weightClass": "+78",
    "stats": {
      "power": 9,
      "speed": 6,
      "technique": 7,
      "kumikata": 7,
      "newaza": 8
    },
    "signatureMoveId": 2,
    "lastUpdated": "2025-04-20T15:30:00Z",
    "profileUrl": "https://en.wikipedia.org/wiki/Nina_Cutro-Kelly",
    "bio": "More info to come...",
    "gender": "female",
    "isHidden": false,
    "rarity": "Common",
    "cardCode": "WKZ3-H4NF-MXT2-LQ93-JT8D",
    "matchesWon": 0,
    "matchesLost": 0,
    "matchesDrew": 0
  },
  {
    "id": 776,
    "firstname": "Shōzō",
    "surname": "Fujii",
    "country": "Japan",
    "countryCode": "jp",
    "weightClass": "-81",
    "stats": {
      "power": 8,
      "speed": 8,
      "technique": 8,
      "kumikata": 7,
      "newaza": 8
    },
    "signatureMoveId": 3,
    "lastUpdated": "2025-04-28T15:30:00Z",
    "profileUrl": "https://en.wikipedia.org/wiki/Shōzō_Fujii",
    "bio": "More info to come...",
    "gender": "male",
    "isHidden": false,
    "rarity": "Epic",
    "cardCode": "WKZ3-H4NF-MXT2-LQ93-JT9D",
    "matchesWon": 0,
    "matchesLost": 0,
    "matchesDrew": 0
  }
]
